id,name,avg_resp_time,avg # comms per req,total pages,total requests,# awaiting response,# awaiting appeal,# fix required,# payment required,# rejected,# no responsive docs,# completed,# partially completed,# withdrawn
4862,"Office of the Attorney General - Minnesota, Minnesota",40,4,358,6,0,0,0,0,1,1,6,0,0
4863,"Office of the Attorney General - Missouri, Missouri",52,5,851,4,5,0,1,0,0,0,5,0,0
4864,"Office of the Attorney General - Nebraska, Nebraska",33,3,457,4,3,0,2,0,0,1,2,0,0
4865,"Office of the Attorney General - Nevada, Nevada",155,8,60,3,6,0,1,0,0,0,4,2,0
4866,"Office of the Attorney General - New Hampshire, New Hampshire",29,4,294,4,3,0,1,1,0,1,3,0,0
4867,"Department of Human Resources, Alabama",0,2,0,1,0,0,0,0,0,0,0,0,0
4868,"Office of the Attorney General - New Mexico, New Mexico",46,4,10,3,3,0,1,0,0,2,2,0,0
4869,"Office of the Attorney General - North Carolina, North Carolina",106,8,131,3,5,0,0,0,0,1,2,0,0
4870,"Office of the Attorney General - North Dakota, North Dakota",23,4,3,3,0,0,0,0,0,4,0,0,0
4871,"Office of the Attorney General - Ohio, Ohio",63,6,349,4,4,0,5,0,0,0,6,0,0
4872,"Sheriff, Clallam County, WA",0,1,0,1,0,0,0,0,0,0,0,0,0
4873,"City of McFarland, Mcfarland, CA",44,6,48,2,0,0,0,0,0,2,2,0,0
4874,"Blair County, Blair, PA",0,1,0,1,0,0,0,0,0,0,0,0,0
4875,"Quincy Inspectional Services, Quincy, MA",0,9,0,1,1,0,0,0,0,0,0,0,0
4876,"Duluth Police Department, Duluth, MN",0,1,0,1,0,0,0,0,0,0,0,0,0
4877,"Washington State Department of Transportation - Ferries, Washington",0,1,0,1,0,0,0,0,0,0,0,0,0
4878,"Department of Justice, Delaware",29,4,14,4,0,0,0,0,1,2,1,0,0
4879,"City of Delaware City, Delaware City, DE",233,6,21,2,0,1,0,0,3,0,2,0,0
4881,"Massachusetts Turnpike Authority, Massachusetts",0,0,0,0,0,0,0,0,0,0,0,0,0
4882,"Alcoholic Beverage Control, Virginia",18,7,586,3,0,0,0,0,0,0,3,0,0
4883,"Department of Agriculture,  Natural Resources Conservation Service, United States of America",0,14,0,1,0,0,0,0,0,0,0,0,0
4884,"Manhattan District Attorney's Office, New York City, NY",154,10,164,13,16,0,1,5,4,3,10,0,0
4887,"Virginia State Bar, Virginia",0,3,0,1,0,0,0,0,0,0,0,0,0
4889,"California State University, Fullerton - University Police, California",4,2,0,1,0,0,0,0,0,1,0,0,0
4890,"Hacienda La Puente Unified School District - Police, La Puente, CA",0,0,0,0,0,0,0,0,0,0,0,0,0
4891,"Los Angeles County Sheriff's Department - Industry Station, Industry, CA",0,0,0,0,0,0,0,0,0,0,0,0,0
4892,"Mt. San Antonio College District - Public Safety Police, Walnut, CA",0,0,0,0,0,0,0,0,0,0,0,0,0
4893,"Department of Defense, United States of America",155,6,27,3,2,0,1,0,0,0,2,0,0
4894,"Binghamton Police Department, Binghamton, NY",1,6,540,4,0,0,3,1,0,1,3,0,0
4895,"Binghamton Office of the Mayor, Binghamton, NY",3,2,435,4,0,0,2,0,0,0,2,0,0
4896,"Binghamton City School District, Binghamton, NY",15,3,2,4,0,0,0,0,0,0,4,0,0
4897,"Buffalo Police Department, Buffalo, NY",36,8,90,7,7,0,3,2,0,2,7,0,0
4898,"Buffalo City School District, Buffalo, NY",62,7,6,4,0,0,1,0,0,0,3,0,0
4899,"Buffalo Mayor's Office, Buffalo, NY",261,19,35,4,1,0,0,0,0,1,2,1,0
4900,"Rainsville City Hall, Rainsville, AL",0,25,0,1,0,0,0,0,0,0,0,0,0
4901,"Longview Police Department, Longview, TX",24,6,22,1,2,0,0,0,0,0,2,0,0
4903,"New Castle County Police Department, New Castle County, DE",13,7,3,2,1,0,0,0,1,1,0,0,0
4905,"Vineland Police Department, Cumberland County, NJ",7,4,49,1,0,0,1,0,0,0,2,0,0
4906,"Millville Police Department, Cumberland County, NJ",101,8,3,1,0,0,0,0,0,0,1,0,0
4908,"City of Bridgeton, Bridgeton, NJ",0,4,163,1,0,0,0,0,0,0,0,0,0
4910,"Office of the Attorney General - Oklahoma, Oklahoma",159,15,6,3,3,0,0,0,0,1,2,0,0
4911,"Office of the Attorney General - Oregon, Oregon",24,9,5,4,8,0,6,0,0,2,2,1,0
4912,"Office of the Attorney General - Pennsylvania, Pennsylvania",46,3,23,7,1,0,0,1,2,2,1,0,0
4913,"Office of the Attorney General - South Carolina, South Carolina",0,21,0,3,0,0,0,0,0,0,0,0,0
4914,"Office of the Attorney General - South Dakota, South Dakota",28,3,12,3,0,0,0,0,0,2,2,0,0
4916,"Office of the Attorney General - Utah, Utah",360,8,9,3,7,0,2,1,0,0,1,1,0
4917,"Office of the Attorney General - Washington, Washington",50,9,4596,3,6,0,5,4,0,0,3,2,0
4918,"Office of the Attorney General - West Virginia, West Virginia",115,8,112,3,3,0,0,0,0,2,2,0,0
4919,"Office of the Attorney General - Wyoming, Wyoming",36,15,1,3,1,0,0,0,0,2,0,0,0
4920,"Department of Health and Social Services, Alaska",28,3,18,1,0,0,0,0,0,0,1,0,0
4921,"Health and Human Services Agency - California, California",92,9,0,2,9,0,0,0,0,1,0,0,0
4922,"Department of Human Services, Colorado",0,3,42,1,0,0,0,0,0,0,0,0,0
4923,"Department of Social Services, Connecticut",77,7,0,1,0,0,0,0,1,0,0,0,0
4924,"Department of Health and Social Services, Delaware",0,2,1,1,0,0,0,0,0,0,0,1,0
4925,"Department of Human Services, Georgia",4,1,17,2,0,0,0,0,0,0,1,0,0
4926,"Department of Human Services, Hawaii",29,7,13,1,1,0,0,1,0,0,2,1,0
4927,"City of Winnfield Police Department, Winnfield, LA",163,11,8,2,0,0,0,0,0,2,0,0,0
4930,"Kinder Police Department, Kinder, LA",307,28,3,2,0,0,0,0,0,1,0,0,0
4931,"State University of New York Rockland Community College, New York",183,16,14,1,1,0,0,0,0,0,1,0,0
4932,"University of Delaware, Delaware",21,2,0,4,1,0,0,0,2,0,1,0,0
4934,"City of Newark, Newark, DE",36,4,5,5,0,0,7,0,0,0,1,1,0
4936,"University of Arkansas Libraries, Arkansas",15,4,2,1,0,0,0,0,0,0,0,0,0
4938,"Hot Springs Police Department, Hot Springs, AR",0,1,0,2,0,0,0,0,0,0,0,0,0
4940,"Calexico Police Department, Calexico, CA",101,9,132,1,0,0,0,0,0,0,4,0,0
4941,"FDA  Federal Food and Drug administration, United States of America",0,0,0,0,0,0,0,0,0,0,0,0,0
4943,"Biddeford Police Department, Biddeford, ME",0,2,0,2,0,0,0,0,0,1,0,0,0
4945,"Department of Homeland Security, Office for Civil Rights and Civil Liberties, United States of America",0,9,0,3,1,0,3,0,0,0,0,0,0
4946,"Delaware State University, Delaware",38,4,0,1,0,0,0,0,0,0,1,0,0
4948,"Financial Services, Somerset County, NJ",0,1,0,1,0,0,0,0,0,0,0,0,0
4949,"Fulton County Police Department, Fulton County, GA",0,0,0,0,0,0,0,0,0,0,0,0,0
4950,"U.S. Senate Disbursing Office, United States of America",0,3,0,2,1,0,1,0,0,1,0,0,0
4951,"City of Adelanto, Adelanto, CA",60,8,306,5,3,0,2,0,0,2,15,0,0
4952,"LaSalle Economic Development District, Jena, LA",124,9,84,1,0,0,0,0,0,2,2,0,0
4953,"Town of Jena, Jena, LA",0,5,0,1,0,0,1,0,0,1,0,0,0
4954,"City of Alexandria, Alexandria, LA",246,17,0,2,0,0,0,0,0,3,0,0,0
4955,"Alexandria Police Department, Alexandria, LA",37,6,23,2,0,0,1,0,0,4,0,0,0
4956,"Vineland Police Department, Vineland, NJ",28,6,1082,6,5,0,0,0,1,1,15,2,0
4957,"Erie County District Attorney's Office, Erie County, NY",4,5,2,1,0,0,1,0,0,1,0,0,0
4959,"St. Petersburg Police Department, Pinellas County, FL",44,3,233,5,2,0,0,0,0,0,5,0,0
4960,"Iowa City School District, Iowa City, IA",116,12,38,4,5,0,2,0,0,4,3,0,0
4961,"Defense Media Activity, United States of America",0,6,3,1,1,0,0,1,0,0,0,0,0
4962,"Dennis Carlone, Cambridge City Council, Cambridge, MA",0,0,0,0,0,0,0,0,0,0,0,0,0
4963,"Cambridge City Council, Cambridge, MA",0,3,0,4,1,0,1,0,0,0,0,0,0
4966,"Cleveland Municipal Court Criminal Traffic Division, Cuyahoga County, OH",0,6,0,1,0,0,1,0,0,0,0,0,0
4970,"Department of Veterans Affairs, Office of Inspector General, United States of America",28,5,52,3,4,0,0,0,0,0,4,0,0
4971,"United States Attorney's Office, Western District of New York, United States of America",146,5,5,1,1,0,0,1,1,0,0,0,0
4972,"Department of Revenue, Colorado",2,4,0,1,0,0,0,0,0,1,0,0,0
4973,"Department of Revenue, Alaska",0,2,0,1,0,0,0,0,0,1,0,0,0
4975,"Cuyahoga County Sheriff, Cuyahoga County, OH",0,1,0,1,0,0,0,0,0,0,0,0,0
4976,"Black out Collective, Oakland, CA",0,1,0,1,0,0,0,0,0,0,0,0,0
4977,"Kansas Bureau of Investigation, Kansas",21,8,9,1,1,0,0,0,0,0,0,0,1
4981,"National Marine Fisheries Service, United States of America",0,15,10,2,3,2,4,0,0,0,0,0,0
4983,"Waterloo School District, Waterloo, IA",53,13,0,1,2,0,0,4,0,0,1,0,0
4984,"Lincoln County Sheriff's Department, Lincoln County, NV",0,7,0,2,3,0,2,1,0,0,0,0,0
4985,"Lincoln County Emergency Management Office, Lincoln County, NV",18,3,0,1,0,0,0,0,0,1,0,0,0
4986,"Clearwater Police Department, Clearwater, FL",64,8,148,3,3,0,0,0,0,0,10,0,0
4987,"Federal Maritime Commission, United States of America",26,2,0,2,0,0,0,0,1,1,0,0,0
4988,"Police Department, New Canaan, CT",0,1,0,1,0,0,0,0,0,0,0,0,0
4990,"City of Aurora, Aurora, CO",2,3,1,2,0,0,0,0,0,1,0,0,0
4991,"Baldwin Park Police Department, Baldwin Park, CA",0,28,0,3,3,0,0,0,0,0,0,0,0
4992,"City of Baldwin Park, Baldwin Park, CA",0,3,1,1,0,0,0,0,0,0,0,0,0
4993,"Panama City Police Department, Panama City, FL",148,5,0,2,1,0,0,0,0,1,0,0,0
4994,"City of Big Spring, Big Spring, TX",0,25,0,1,0,0,0,0,0,0,0,0,0
4995,"Big Spring Police Department, Big Spring, TX",320,26,3,2,0,0,3,1,0,0,1,0,0
4996,"City of Milton, Milton, FL",0,4,0,1,0,0,1,1,0,0,0,0,0
4997,"Milton Police Department, Milton, FL",0,24,0,2,0,0,0,0,0,0,0,0,0
4998,"City of Falfurrias, Falfurrias, TX",14,2,12,1,0,0,0,0,0,1,0,0,0
4999,"Falfurrias Police Department, Falfurrias, TX",34,14,0,2,0,0,0,0,0,1,0,0,0
5000,"City of Pompano Beach, Pompano Beach, FL",0,3,0,1,0,0,1,0,0,0,0,0,0
5002,"Office of State Employment Relations, Wisconsin",84,4,2,2,1,0,0,0,0,0,1,0,0
5003,"Williamson County Clerk - Courts Division, Williamson County, TX",22,4,3,3,0,0,4,0,0,1,0,0,0
5004,"U.S. Air Force - Global Strike Command, United States of America",0,2,0,1,0,0,0,0,0,0,0,0,0
5005,"North Allegheny School District, Mccandless, PA",58,22,585,1,4,0,0,0,0,2,11,0,0
5006,"Butler Area School District, Cranberry, PA",36,11,518,1,2,0,0,0,0,0,3,0,0
5007,"Seneca Valley School District, Harmony, PA",38,9,358,1,2,0,0,0,0,0,3,0,0
5008,"Anchorage Correctional Complex, Alaska",79,5,2,1,0,0,0,0,0,0,2,0,0
5009,"Arizona State Prison Complex - Phoenix, Arizona",64,6,1,1,0,0,0,0,0,1,0,0,0
5010,"Colorado State Penitentiary, Colorado",0,36,0,1,0,0,0,0,0,0,0,0,0
5011,"Fulton County Schools Police Department, Fulton County, GA",0,37,6,2,0,0,0,0,0,0,0,0,0
5014,"Department of the Navy, Office of the General Counsel, United States of America",70,5,4,1,0,0,0,0,0,2,0,0,0
5015,"Maryland National Guard, United States of America",0,0,0,0,0,0,0,0,0,0,0,0,0
5016,"Josephine County Sheriff's Office, Josephine County, OR",0,23,0,1,0,0,0,0,0,0,0,0,0
5017,"District Attorney Office, Josephine County, OR",7,3,1,2,0,0,1,0,0,1,0,0,0
5018,"Surveyor Office, Josephine County, OR",0,3,4,1,0,0,2,0,0,0,0,0,0
5019,"Clerk Office, Josephine County, OR",0,23,0,1,0,0,0,0,0,0,0,0,0
5022,"Abbevile Police Department, Abbeville, AL",32,4,0,1,0,0,0,0,0,1,0,0,0
5023,"Police Dept., Joliet, IL",0,1,0,1,0,0,0,0,0,0,0,0,0
5026,"Needham Public Schools, Needham, MA",0,3,2,1,0,0,0,2,0,0,0,0,0
5027,"City of Fort Collins Police Department, Fort Collins, CO",96,13,219,1,2,0,1,0,0,0,3,0,0
5028,"Bronx County District Attorney's Office, New York",0,16,0,1,7,0,0,1,0,0,0,0,0
5029,"Department of Health and Welfare, Idaho",34,11,172,1,1,0,2,2,0,0,4,0,0
5030,"Department of Human Services, Illinois",14,3,0,1,0,0,0,0,0,0,2,0,0
5031,"Family and Social Services Administration, Indiana",39,7,113,1,3,0,0,0,0,0,1,0,0
5032,"Department of Human Services, Iowa",11,6,0,1,0,0,1,0,0,1,0,0,0
5033,"Department for Children and Families, Kansas",14,5,4,1,1,0,0,0,0,0,2,0,0
5034,"Cabinet for Health and Family Services, Kentucky",29,4,4,1,0,0,0,0,2,0,0,0,0
5035,"Department of Children and Family Services, Louisiana",81,9,0,1,1,0,0,0,0,1,0,0,0
5036,"Department of Human Resources, Maryland",0,24,0,1,0,0,0,0,0,0,0,0,0
5037,"Department of Human Services, Michigan",0,3,7,1,1,0,1,0,0,0,0,0,0
5038,"Department of Human Services, Minnesota",19,4,246,2,1,0,0,0,2,0,1,0,0
5039,"Department of Human Services, Mississippi",0,3,10,1,0,0,2,0,0,0,0,0,0
5040,"Department of Social Services, Missouri",27,9,25,1,0,0,0,2,0,0,3,0,0
5041,"Department of Health and Human Services, Nebraska",11,5,0,1,0,0,0,0,0,1,0,0,0
5042,"Department of Health and Human  Services, Nevada",1,2,49,3,0,0,1,0,0,1,2,0,0
5043,"Department of Health and Human Services, New Hampshire",53,3,0,2,0,0,0,0,1,0,0,0,0
5044,"Department of Human Services, North Dakota",8,3,32,1,0,0,0,0,0,0,2,0,0
5045,"Department of Jobs and Family Services, Ohio",5,2,2,1,0,0,0,0,0,1,0,0,0
5046,"Houston Independent School District, Houston, TX",246,9,4,1,1,0,0,2,0,0,0,0,1
5047,"Navy Expeditionary Combat Command, United States of America",0,16,2,1,1,0,1,0,0,0,0,0,0
5048,"City of Santa Clara Police Department, Santa Clara, CA",13,13,273,2,0,0,0,0,0,1,22,0,0
5049,"Department of Education, West Virginia",7,4,5,2,0,0,0,1,0,1,0,0,0
5050,"Santa Cruz County Sheriff's Office, Santa Cruz, CA",0,24,0,1,0,0,0,0,0,0,0,0,0
5051,"City of McFarland Police Department, Mcfarland, CA",53,5,1,3,1,0,5,0,0,0,0,0,1
5052,"Department of Cultural Affairs, New York City, NY",22,3,21,1,0,0,0,0,0,0,1,0,0
5053,"Civilian Complaint and Review Board, New York City, NY",28,3,3,2,1,0,0,0,1,0,0,0,0
5055,"Garrett County Schools, Garrett County, MD",56,5,79,1,0,0,0,0,0,0,2,0,0
5056,"Office of the Attorney General - Alabama, Alabama",0,3,3,2,0,0,2,0,0,0,0,0,0
5057,"Office of the Attorney General - Alaska, Alaska",12,4,8,2,0,0,3,0,0,1,0,0,0
5065,"Office of the Attorney General - New Jersey, New Jersey",14,13,4,4,4,0,0,0,0,2,0,0,0
5068,"Office of the Attorney General - Tennessee, Tennessee",22,2,2,3,0,0,0,0,2,0,0,0,0
5073,"Carmichaels Area School District, Greene County, PA",118,17,3,1,0,0,1,0,0,2,0,0,0
5074,"Central Greene School District, Greene County, PA",237,15,12,1,0,0,0,0,2,0,0,0,0
5075,"Southeastern Greene School District, Greene County, PA",0,0,0,0,0,0,0,0,0,0,0,0,0
5076,"City of Pittsburgh, Pittsburgh, PA",63,11,350,1,1,0,0,2,0,0,3,0,0
5077,"Garland Texas Police Department, Garland, TX",18,5,3,2,1,0,1,0,0,3,0,0,0
5078,"Albion Department of Public Safety, Albion, MI",56,11,67,1,1,0,0,2,0,0,4,0,0
5079,"Lombard Police Department, Lombard, IL",2,2,5,1,0,0,0,0,0,0,1,0,0
5080,"Fairfax County Police Department, Virginia",0,1,0,1,0,0,0,0,0,0,0,0,0
5081,"Fairfax County Adult Detention Center, Virginia",3,3,0,2,0,0,2,0,0,1,0,0,0
5082,"Department of Social and Health services, Washington",22,8,7,2,4,0,2,2,0,0,0,0,1
5083,"Fairfax County Police, Virginia",0,1,0,1,0,0,0,0,0,0,0,0,0
5086,"U.S. Army - Fort Stewart - Third Infantry Division, United States of America",0,0,0,0,0,0,0,0,0,0,0,0,0
5090,"Finance Department, Birmingham, AL",0,22,0,1,0,0,0,0,0,0,0,0,0
5091,"Finance Department, Kansas City, MO",0,32,0,1,0,0,0,0,0,0,0,0,0
5092,"Human Resources Department, Phoenix, AZ",32,8,0,1,2,0,0,0,0,0,2,0,0
5093,"Texas Workforce Commission, Texas",30,8,72,1,1,0,0,2,0,0,1,0,0
5094,"Human Resources Development, Hawaii",0,0,0,0,0,0,0,0,0,0,0,0,0
5095,"House of Representatives, Missouri",8,3,0,1,0,0,0,0,2,0,0,0,0
5096,"Walton County Sheriff's Office, Walton County, FL",3,2,0,1,0,0,0,0,0,1,0,0,0
5097,"Washington State University, Washington",53,10,1072,6,13,0,2,0,0,0,27,0,1
5099,"Batte Creek Police Department, Battle Creek, MI",38,5,104,1,0,0,0,1,0,0,1,0,0
5100,"Englewood Police Department, Englewood, NJ",0,0,0,0,0,0,0,0,0,0,0,0,0
5101,"aaaa, United States of America",0,1,0,1,0,0,0,0,0,0,0,0,0
5102,"Monongalia County Schools, Monongalia County, WV",38,7,181,1,0,0,0,2,0,0,2,0,0
5103,"Preston County Schools, Preston County, WV",0,3,3,1,0,0,1,0,0,0,0,0,0
5104,"Wetzel County Schools, Wetzel County, WV",0,9,2,1,1,0,1,0,0,0,0,0,0
5105,"Hernando County Sheriff's Department, Hernando County, FL",42,7,44,1,0,0,0,2,0,0,1,0,0
5106,"DNR, Duluth, MN",0,0,0,0,0,0,0,0,0,0,0,0,0
5107,"Department of Education, Minnesota",0,4,0,2,0,0,1,0,0,0,0,0,0
5109,"Okaloosa County Sheriff’s Office, Okaloosa County, FL",81,14,111,2,4,0,0,0,0,0,3,1,0
5110,"Waco Police Department, Waco, TX",21,6,5,1,0,0,2,0,0,1,0,0,0
5111,"Dallas Fusion Center, Dallas, TX",127,13,11,2,4,2,0,2,0,3,2,0,0
5112,"Department of Business Affairs and Consumer Protection, Chicago, IL",14,6,33,3,4,0,5,0,0,0,2,1,0
5113,"Chapel Hill Police Department, Chapel Hill, NC",36,3,13,4,3,0,0,0,0,1,1,0,0
5114,"Delaware Criminal Justice Information System, Delaware",0,2,4,3,1,0,0,2,0,0,0,0,0
5115,"Deparment of Defense, United States of America",0,0,0,0,0,0,0,0,0,0,0,0,0
5116,"City of Wheelwright, Wheelwright, KY",0,22,0,2,0,0,0,0,0,0,0,0,0
5117,"Cambria County, Cambria County, PA",2,2,0,1,0,0,0,0,0,1,0,0,0
5119,"Springdale Police Department, Springdale, AR",0,13,0,2,0,0,0,0,0,0,0,0,0
5121,"Police Department, Attleboro, MA",0,23,0,1,1,0,0,0,0,0,0,0,0
5122,"New Bedford Police Department, New Bedford, MA",25,3,2,2,0,0,0,0,1,1,0,0,0
5123,"Director, Office of Information Policy, United States of America",0,0,0,0,0,0,0,0,0,0,0,0,0
5124,"Industrial Development Financing Authority, Boston, MA",18,4,36,1,1,0,0,0,0,0,1,0,0
5125,"Special Committee on the 2024 Olympics, Boston, MA",0,2,0,1,0,0,0,0,0,1,0,0,0
5127,"Philadelphia City School District, Philadelphia, PA",68,8,5149,3,4,0,0,0,0,0,12,0,0
5128,"Pittsburgh Public Schools, Pittsburgh, PA",223,10,216,2,5,0,1,1,0,0,2,0,0
5129,"Central Bucks County School District, Bucks County, PA",220,11,612,1,1,0,0,2,0,0,3,0,0
5130,"Reading School District, Reading, PA",46,9,291,1,1,0,3,0,0,0,1,0,0
5131,"Allentown School District, Allentown, PA",0,25,0,1,0,0,0,0,0,0,0,0,0
5132,"Bethlehem Area School District, Bethlehem, PA",27,6,239,1,2,0,0,0,0,0,2,0,0
5133,"North Penn Area School District, Lansdale, PA",0,2,2,1,0,0,0,0,0,0,1,0,0
5134,"Erie Area School District, Erie, PA",221,8,359,1,1,0,0,1,0,0,2,0,0
5135,"Upper Darby Area School District, Upper Darby, PA",0,13,21,1,3,0,1,2,0,0,0,0,0
5136,"West Chester Area School District, West Chester, PA",54,8,201,1,1,0,0,0,0,0,3,0,0
5137,"Downingtown Area School District, Downingtown, PA",265,10,133,1,2,0,0,1,0,0,3,0,0
5138,"Council Rock School District, Newtown, PA",54,11,253,1,1,0,2,0,0,0,5,0,0
5139,"Lancaster Area School District, Lancaster, PA",46,6,81,1,0,0,0,0,0,0,2,0,0
5140,"Central Dauphin Area School District, Harrisburg, PA",39,6,179,1,0,0,0,0,0,0,4,0,0
5141,"Pennsbury Area School District, Bucks County, PA",0,25,3,1,1,0,0,0,0,0,0,0,0
5142,"Hazleton Area School District, Hazleton, PA",39,8,69,1,3,0,0,0,0,0,1,0,0
5143,"Pocono Mountain Area School District, Monroe County, PA",38,21,154,1,2,0,0,0,0,0,17,0,0
5144,"Kanawha County School District, Kanawha County, WV",38,4,12,1,1,0,0,0,0,0,1,0,0
5145,"Marion County School District, Marion County, WV",0,25,0,1,0,0,0,0,0,0,0,0,0
5146,"Scranton School District, Scranton, PA",119,12,91,1,0,0,0,1,0,0,2,0,0
5147,"Parkland School District, North Whitehall, PA",38,5,3,1,2,0,0,0,0,0,1,0,0
5148,"Easton Area School District, Easton, PA",230,15,11,1,3,0,1,0,0,0,1,0,0
5149,"Neshaminy School District, Langhorne, PA",26,4,25,1,1,0,0,0,0,0,1,0,0
5150,"Chambersburg Area School District, Chambersburg, PA",25,6,119,1,3,0,0,0,0,0,1,0,0
5151,"East Penn School District, Emmaus, PA",35,8,291,1,1,0,0,0,0,0,5,0,0
5152,"Altoona Area School District, Altoona, PA",0,25,0,1,0,0,0,0,0,0,0,0,0
5153,"Oklahoma Department of Human Services, Oklahoma",0,5,1,1,2,0,0,0,0,0,0,0,0
5154,"Department of Human Services, Oregon",0,20,0,1,0,0,0,0,0,0,0,0,0
5155,"Department of Human Services, Rhode Island",13,2,3,1,0,0,0,0,0,0,1,0,0
5156,"Department of Human Services, Pennsylvania",42,5,135,2,5,0,0,0,0,0,1,0,0
5157,"Department of Health and Human Services, South Carolina",40,4,0,1,0,0,0,0,0,0,1,0,0
5158,"Department of Human Services, Utah",17,3,0,1,0,0,0,0,0,1,0,0,0
5159,"Department of Education, Department of Veterans Affairs,, United States of America",0,1,0,1,0,0,0,0,0,0,0,0,0
5160,"Department of Defense, Sexual Assault Prevention and Response, United States of America",36,7,0,1,0,0,1,0,0,2,0,0,0
5162,"Bicycle Advisory Committee, Minneapolis, MN",80,7,0,1,0,0,0,0,0,1,0,0,0
5163,"Department of Natural Resources (Minnesota), Minnesota",0,1,0,1,0,0,0,0,0,0,0,0,0
5165,"Smyrna Police Department, Smyrna, DE",25,4,0,1,1,0,0,0,0,1,0,0,0
5166,"Seaford Police Department, Seaford, DE",54,5,33,1,0,0,0,0,0,0,1,0,0
5167,"Senatobia Police Department, Senatobia, MS",17,3,0,1,0,0,0,0,0,1,0,0,0
5168,"National Nuclear Security Administration, United States of America",97,6,354,5,10,0,1,0,0,0,5,0,0
5169,"San Francisco Sheriff's Department, San Francisco City and County, CA",47,5,0,1,0,0,0,0,0,1,0,0,0
5170,"Pipeline and Hazardous Materials Safety Administration, United States of America",33,3,3,2,1,0,0,0,0,0,1,0,0
5172,"mayor''s, Boston, MA",0,1,0,1,0,0,0,0,0,0,0,0,0
5173,"Department of Social Services, California",39,8,0,1,2,0,0,0,0,0,2,0,0
5174,"Department of Children and Families, Florida",0,5,0,1,1,0,1,0,0,0,0,0,0
5175,"University of Nebraska, Nebraska",9,4,16,3,1,0,1,0,0,1,1,0,0
5176,"Trumbull Police Department, Trumbull, CT",23,6,10,3,4,0,1,0,0,1,3,0,0
5177,"FRANKLIN REGIONAL SCHOOL DISTRICT, Murrysville, PA",18,6,71,1,1,0,0,0,0,0,3,0,0
5178,"SOUTHMORELAND SCHOOL DISTRICT, Westmoreland County, PA",98,16,25,1,5,0,0,0,0,0,3,0,0
5179,"LIGONIER VALLEY SCHOOL DISTRICT, Ligonier, PA",28,7,11,1,0,0,0,2,0,0,2,0,0
5180,"DERRY AREA SCHOOL DISTRICT, Derry, PA",0,0,0,0,0,0,0,0,0,0,0,0,0
5181,"GREATER LATROBE SCHOOL DISTRICT, Latrobe, PA",2,3,11,1,0,0,0,0,0,0,2,0,0
5182,"JEANNETTE CITY SCHOOL DISTRICT, Jeannette, PA",0,5,9,1,2,0,0,1,0,0,0,0,0
5183,"NEW KENSINGTON-ARNOLD SCHOOL DISTRICT, New Kensington, PA",21,5,8,1,1,0,0,0,0,0,2,0,0
5184,"MONESSEN CITY SCHOOL DISTRICT, Monessen, PA",40,23,2,1,1,0,0,0,0,0,1,0,0
5185,"Arizona Department of Insurance, Arizona",0,8,0,3,0,0,1,0,0,0,0,0,0
5186,"Connecticut Insurance Department, Connecticut",29,5,3,3,5,0,0,0,1,0,0,0,0
5187,"Pennsylvania Insurance Department, Pennsylvania",12,4,25,2,2,0,0,0,2,0,2,0,0
5188,"New Haven Police Department, New Haven, CT",0,1,0,1,0,0,0,0,0,0,0,0,0
5190,"Cambridge Election Commission, Cambridge, MA",0,0,0,0,0,0,0,0,0,0,0,0,0
5191,"Federal Transit Administration, United States of America",23,6,422,3,3,0,0,0,0,0,8,0,0
5192,"Federal Railroad Administration, United States of America",10,2,2,2,1,0,0,0,0,0,1,0,0
5193,"United States Postal Service, Office of Inspector General, United States of America",0,2,1,1,0,0,0,0,0,0,0,0,0
5194,"New York City Economic Development Corporation, New York City, NY",173,7,9,2,5,0,2,0,0,1,2,0,0
5195,"Police Department, McKinney, TX",94,15,476,5,20,0,0,0,0,0,11,0,0
5196,"Animal Plant and Health Inspection Service, United States of America",39,8,38,4,11,0,0,0,1,1,1,1,0
5197,"Buffalo Corporation Counsel, Buffalo, NY",24,4,278,2,1,0,0,0,1,0,1,0,0
5198,"Buffalo Public Schools, Buffalo, NY",18,4,0,1,2,0,0,0,0,0,1,0,0
5200,"McDuffie County Schools, McDuffie County, GA",7,4,1,1,1,0,0,0,0,0,1,0,0
5201,"Robertson County Schools, Robertson County, TN",0,3,1,1,0,0,1,0,0,0,0,0,0
5202,"Lincoln Parish Schools, Lincoln County, LA",3,2,1,1,0,0,0,0,0,0,1,0,0
5203,"California Department of Transportation, California",15,3,0,1,0,0,0,0,0,1,0,0,0
5204,"Carlsbad Police Department, Carlsbad, NM",123,10,3,1,1,0,0,0,0,1,0,0,0
5205,"Chaves County Sheriff's Office, Chaves County, NM",0,2,0,1,0,0,0,0,0,1,0,0,0
5206,"Eddy County Sheriff's Department, Eddy County, NM",25,11,0,1,2,0,2,0,0,1,0,0,0
5207,"Hobbs Police Department, Hobbs, NM",52,8,1,1,1,0,0,0,0,1,0,0,0
5208,"Lea County Sheriff's Department, Lea County, NM",10,2,2,1,0,0,0,0,0,0,1,0,0
5209,"Lincoln County Sheriff's Department, Lincoln County, NM",5,4,5,1,0,0,0,0,0,0,2,0,0
5210,"Pecos Valley Drug Task Force, Carlsbad, NM",0,20,0,1,0,0,0,0,0,0,0,0,0
5211,"Roswell Police Department, Roswell, NM",28,4,25,1,1,0,0,0,0,0,1,0,0
5212,"Roosevelt Sheriff's Department, Roosevelt County, NM",0,18,0,1,0,0,0,0,0,0,0,0,0
5213,"New Port Richey Police Department, New Port Richey, FL",16,3,0,1,0,0,0,0,1,0,0,0,0
5214,"Revere  city solicitor, Revere, MA",77,8,0,1,1,0,0,0,0,0,1,0,0
5215,"Harlingen Police Department, Harlingen, TX",0,2,1,1,0,0,0,0,0,1,0,0,0
5217,"Fresno Police Department, Fresno, CA",63,8,0,4,2,0,1,0,1,2,0,0,0
5218,"Colorado Springs Police Department, Colorado Springs, CO",0,3,74,4,2,0,0,3,0,2,1,0,0
5219,"Omaha Police Department, Omaha, NE",42,4,150,4,1,0,1,0,0,1,2,0,0
5220,"Bakersfield Police Department, Bakersfield, CA",163,12,521,6,2,0,0,0,1,1,6,0,0
5221,"Santa Ana Police Department, Santa Ana, CA",25,5,166,3,3,0,0,0,0,0,6,0,0
5222,"Reno Police Department, Reno, NV",62,11,2,1,1,0,0,0,0,1,0,0,0
5223,"Corpus Christi Police Department, Corpus Christi, TX",5,1,77,4,0,0,1,0,0,0,2,0,0
5224,"Glendale Police Department, Glendale, AZ",139,3,66,3,1,0,0,2,0,0,3,0,0
5225,"Riverside Police Department, Riverside, CA",0,17,0,3,0,0,0,0,0,0,0,0,0
5226,"Durham Police Department, Durham, NC",29,2,112,5,0,0,1,0,0,2,3,0,0
5227,"Anchorage Police Department, Anchorage, AK",47,4,2,4,3,0,3,0,0,0,2,0,0
5228,"Irving Police Department, Irving, TX",28,4,319,5,4,0,2,0,1,1,4,0,0
5229,"Stockton Police Department, Stockton, CA",14,4,149,5,2,0,4,0,2,0,4,0,0
5230,"Baton Rouge Police Department, Baton Rouge-East Baton Rouge, LA",26,5,51,3,3,0,1,2,0,0,4,0,0
5231,"Greensboro Police Department, Greensboro, NC",3,2,1,3,0,0,1,0,0,1,3,0,0
5232,"Irvine Police Department, Irvine, CA",0,18,0,4,0,0,0,0,0,0,0,0,0
5233,"Plano Police Department, Plano, TX",53,3,56,4,2,0,1,0,0,2,3,0,0
5234,"Lubbock Police Department, Lubbock, TX",94,8,242,3,12,0,0,0,0,1,3,0,0
5235,"Jersey City Police Department, Jersey City, NJ",0,20,0,3,0,0,0,0,0,0,0,0,0
5236,"Winston-Salem Police Department, Winston-Salem, NC",36,5,23,3,2,0,1,0,0,1,1,0,0
5237,"Chula Vista Police Department, Chula Vista, CA",16,3,61,3,0,0,1,0,0,0,5,0,0
5238,"Laredo Police Department, Laredo, TX",24,2,76,4,0,0,1,0,0,1,2,0,0
5239,"GRTC Transit System, Virginia",1,5,0,1,1,0,0,0,0,0,2,0,0
5240,"Minnesota State Patrol, Minnesota",29,11,30,1,1,0,0,2,0,0,3,0,0
